{
  "schema_version": "1.0",
  "plan_date": "2026-09-24",
  "source_scan": {
    "scan_date": "2026-09-24",
    "report_schema_version": "1.0",
    "session_id": "sesn_example0001"
  },
  "waves": [
    {
      "wave": 1,
      "title": "Oracle Database 19c security patching on petclinic-db01 (RU 19.32 + OJVM 19.32 + Aug/Sep 2026 CSPU)",
      "component_keys": [
        "oracle-database",
        "oracle-ojvm"
      ],
      "modules": [
        "petclinic-infra"
      ],
      "depends_on": [],
      "targets": [
        {
          "component_key": "oracle-database",
          "from": "19.3.0.0.0, no Release Update applied (db-inventory.yaml:6-7)",
          "to": "19c RU 19.32 (Jul 2026 CPU) + Aug 2026 CSPU DB patch + Sep 2026 CSPU DB patch; MOS patch numbers UNVERIFIED (login required). Stays on 19c LTR unless decision D5 selects 26ai"
        },
        {
          "component_key": "oracle-ojvm",
          "from": "none applied (db-inventory.yaml:8)",
          "to": "OJVM RU 19.32 matching the DB RU (patch number UNVERIFIED, MOS)"
        }
      ],
      "intermediate_steps": [
        "OPatch / RU prerequisites per the RU readme (UNVERIFIED - MOS login required)",
        "Prefer out-of-place patching: clone the 19.3 Oracle home, patch the clone, switch the database to it (keeps the unpatched home for rollback)",
        "RU 19.32 (cumulative - intermediate RUs 19.4..19.31 are not required)",
        "OJVM RU 19.32 (requires the database in upgrade mode / downtime - decision D5 patch window)",
        "Aug 2026 CSPU DB patch",
        "Sep 2026 CSPU DB patch",
        "datapatch -verbose, then utlrp.sql",
        "Follow-up cycle, same procedure and gates: the next quarterly Oracle CPU once published (the report lists the next CPU date; no migration date is set here)",
        "Post-deployment record (not a code change, not part of any wave patch): DBA updates petclinic-infra/oracle/db-inventory.yaml:6-8 to the verified patch level"
      ],
      "changes": [],
      "entry_gates": [
        {
          "check": "Decision D5 approved (patch window, stay on 19c)",
          "how": "Change ticket with DBA + security sign-off",
          "pass_criterion": "Ticket approved by dba and security"
        },
        {
          "check": "Full backup restorable",
          "how": "RMAN> BACKUP DATABASE PLUS ARCHIVELOG; RMAN> RESTORE DATABASE VALIDATE;",
          "pass_criterion": "Both commands complete with 0 RMAN- errors"
        },
        {
          "check": "Guaranteed restore point",
          "how": "SQL> CREATE RESTORE POINT pre_ru1932 GUARANTEE FLASHBACK DATABASE; SELECT name, guarantee_flashback_database FROM v$restore_point WHERE name='PRE_RU1932';",
          "pass_criterion": "1 row, GUARANTEE_FLASHBACK_DATABASE = YES"
        },
        {
          "check": "No patch conflicts",
          "how": "$ORACLE_HOME/OPatch/opatch prereq CheckConflictAgainstOHWithDetail -ph <each unzipped patch dir>",
          "pass_criterion": "Output 'Prereq \"checkConflictAgainstOHWithDetail\" passed.' for all four patches"
        },
        {
          "check": "OS certification of RU 19.32 on Oracle Linux 7.6",
          "how": "MOS certification matrix lookup by DBA (UNVERIFIED in the report)",
          "pass_criterion": "Certified = yes, recorded in the ticket; otherwise stop and escalate to decision D8"
        },
        {
          "check": "Rehearsal on a non-production clone of PETCLINIC",
          "how": "Run this wave's full procedure and exit gates on the clone",
          "pass_criterion": "All exit gates PASS on the clone"
        },
        {
          "check": "Baseline recorded",
          "how": "SELECT COUNT(*) FROM dba_objects WHERE status='INVALID'; SELECT comp_id,status FROM dba_registry;",
          "pass_criterion": "Values recorded in the ticket as N0 / component list"
        }
      ],
      "exit_gates": [
        {
          "check": "SQL patches registered",
          "how": "SELECT patch_id, action, status, description FROM dba_registry_sqlpatch ORDER BY action_time;",
          "pass_criterion": "Rows for RU 19.32, OJVM RU 19.32, Aug 2026 CSPU and Sep 2026 CSPU, all ACTION=APPLY and STATUS=SUCCESS; 0 rows with STATUS<>'SUCCESS'"
        },
        {
          "check": "Binary patches installed",
          "how": "$ORACLE_HOME/OPatch/opatch lspatches",
          "pass_criterion": "Lists the 4 patches of this wave"
        },
        {
          "check": "Release level",
          "how": "SELECT version_full FROM v$instance;",
          "pass_criterion": "19.32.0.0.0"
        },
        {
          "check": "Dictionary healthy",
          "how": "@?/rdbms/admin/utlrp.sql; SELECT COUNT(*) FROM dba_objects WHERE status='INVALID'; SELECT comp_id,status FROM dba_registry;",
          "pass_criterion": "INVALID count <= N0; every component (incl. JAVAVM) VALID"
        },
        {
          "check": "Application regression (current clients)",
          "how": "curl -s -o /dev/null -w '%{http_code}' http://petclinic-app01:9966/petclinic/api/owners ; run the nightly ops/healthcheck.py (Wave 2 version if already deployed)",
          "pass_criterion": "HTTP 200 and healthcheck exit 0 (api counts == db counts). The current ojdbc6 11.2 client is already an unsupported combination - UNVERIFIED until this gate runs"
        },
        {
          "check": "CVE count for the wave's components = 0",
          "how": "python3 tools/report_cves.py impact-report.json oracle-database,oracle-ojvm  (26 CVEs) and tick each fixed_in level against dba_registry_sqlpatch",
          "pass_criterion": "All 26 report CVEs have fixed_in <= RU 19.32 + Aug/Sep 2026 CSPU and those patches are STATUS=SUCCESS -> 0 open"
        },
        {
          "check": "Restore point released",
          "how": "SQL> DROP RESTORE POINT pre_ru1932;  (only after all gates above PASS)",
          "pass_criterion": "Statement succeeds"
        }
      ],
      "rollback": "Before datapatch completes or on any failed exit gate: shut down, switch the instance back to the retained unpatched 19.3 Oracle home (out-of-place patching) and run datapatch from that home to roll back the SQL changes; for OJVM follow the rollback section of the patch readme (UNVERIFIED - MOS). Last resort (data changes after the patch are lost, needs business sign-off): FLASHBACK DATABASE TO RESTORE POINT pre_ru1932; ALTER DATABASE OPEN RESETLOGS. Re-run the entry-gate baseline queries to confirm the pre-patch state.",
      "approvers": [
        "dba",
        "security",
        "platform-ops"
      ],
      "risk": "medium",
      "effort": "M",
      "evidence": [
        "X01"
      ],
      "status": "NOT_PROVABLE_IN_SANDBOX"
    },
    {
      "wave": 2,
      "title": "Ops health check: CPython 3.6.8 -> 3.14.7, latest libraries, cx_Oracle -> python-oracledb (Thin)",
      "component_keys": [
        "python",
        "requests",
        "urllib3",
        "pyyaml",
        "jinja2",
        "cx-oracle"
      ],
      "modules": [
        "petclinic-infra"
      ],
      "depends_on": [],
      "targets": [
        {
          "component_key": "python",
          "from": "3.6.8 (runtime.txt:1, db-inventory.yaml:14)",
          "to": "3.14.7"
        },
        {
          "component_key": "requests",
          "from": "2.19.1",
          "to": "2.34.2"
        },
        {
          "component_key": "urllib3",
          "from": "1.23",
          "to": "2.8.0"
        },
        {
          "component_key": "pyyaml",
          "from": "3.12",
          "to": "6.0.3"
        },
        {
          "component_key": "jinja2",
          "from": "2.10",
          "to": "3.1.6"
        },
        {
          "component_key": "cx-oracle",
          "from": "cx_Oracle 6.4.1",
          "to": "python-oracledb (oracledb) 26.0.1, Thin mode"
        }
      ],
      "intermediate_steps": [
        "No mandatory intermediate versions (the new libraries install directly on 3.14.7, B26/P05)",
        "platform-ops installs CPython 3.14.7 on petclinic-app01 side by side with 3.6.8 and creates a dedicated venv from ops/requirements.txt; the cron entry is switched to the new venv only after the exit gates pass",
        "Post-deployment record (not a code change): DBA updates petclinic-infra/oracle/db-inventory.yaml:14 to python 3.14.7"
      ],
      "changes": [
        {
          "description": "Declared runtime python-3.6.8 (EOL) -> python-3.14.7",
          "file": "petclinic-infra/ops/runtime.txt",
          "line": 1,
          "impact_ref": "IMP-INFRA-PY"
        },
        {
          "description": "requests==2.19.1 -> requests==2.34.2 (old pins cannot be imported on 3.14, B25)",
          "file": "petclinic-infra/ops/requirements.txt",
          "line": 1,
          "impact_ref": "IMP-INFRA-PY"
        },
        {
          "description": "urllib3==1.23 -> urllib3==2.8.0 (same breaking change as line 1: 'No module named urllib3.packages.six.moves', B25)",
          "file": "petclinic-infra/ops/requirements.txt",
          "line": 2,
          "impact_ref": "IMP-INFRA-PY"
        },
        {
          "description": "PyYAML==3.12 -> PyYAML==6.0.3 (3.12 does not build on 3.14, B24/P03)",
          "file": "petclinic-infra/ops/requirements.txt",
          "line": 3,
          "impact_ref": "IMP-INFRA-PY"
        },
        {
          "description": "cx_Oracle==6.4.1 -> oracledb==26.0.1 (python-oracledb, Thin mode, no Oracle Client)",
          "file": "petclinic-infra/ops/requirements.txt",
          "line": 4,
          "impact_ref": "IMP-INFRA-PY"
        },
        {
          "description": "Jinja2==2.10 -> Jinja2==3.1.6",
          "file": "petclinic-infra/ops/requirements.txt",
          "line": 5,
          "impact_ref": "IMP-INFRA-PY"
        },
        {
          "description": "import collections -> import collections.abc (needed by the :21 fix)",
          "file": "petclinic-infra/ops/healthcheck.py",
          "line": 7,